{
  "schema_version": "1.0.0",
  "agent_run_id": "example-author-run",
  "vendor": "example-vendor",
  "model": "example-model",
  "protocol_version": "1.0.0",
  "capabilities": {
    "can_edit_files": true,
    "can_run_shell": true,
    "can_run_tests": true,
    "can_access_network": false,
    "can_use_browser": false,
    "can_access_external_secrets": false,
    "can_create_branch_or_worktree": true,
    "supported_languages": ["markdown"]
  },
  "limitations": { "max_runtime_minutes": 60 },
  "accepted_work_package": null
}
