{
  "schema_version": "1.0.0",
  "protocol_version": "1.0.0",
  "agent_run_id": "/claude/c0_contract_reviewer",
  "vendor": "Anthropic",
  "model": "claude-opus-5",
  "capabilities": {
    "can_edit_files": true,
    "can_run_shell": true,
    "can_run_tests": true,
    "can_access_network": false,
    "can_use_browser": false,
    "can_access_external_secrets": false,
    "can_create_branch_or_worktree": false,
    "supported_languages": ["javascript", "json", "markdown", "yaml"]
  },
  "limitations": {
    "declaration_origin": "Self-declared by /claude/c0_contract_reviewer on 2026-08-31 while accepting WP-0A-A0-002 as the independent contract/architecture Reviewer. This run is an Anthropic Claude Code session, is distinct from the Author run /claude/a0_atlas, and is distinct from the OpenAI Codex run /root/c0_contract_reviewer declared separately in this directory.",
    "role_scope": "Independent contract/architecture review only. This run holds NO Author, Security/Privacy reviewer, Tester, Integration Owner, Product Owner, Product/UX, merge, or Gate G0 authority. It did not author, and did not contribute to, any part of the change under review, and it must not test-verify, integrate, security-approve, or merge this package.",
    "benchmark_outcome": "No independent or external capability benchmark exists for this run. Its verdict is self-attested Reviewer evidence produced from repository-declared deterministic commands on the pinned toolchain; it is not a certified assessment and it does not advance any gate.",
    "unavailable_tools": ["external secrets", "production credentials", "provider credentials", "Author authority", "Security/Privacy approval authority", "Product/UX approval authority", "Tester authority", "Integration authority", "Product Owner authority", "merge authorization", "Gate G0 approval authority"],
    "harness_note": "The session harness exposes network and browser tooling. These flags declare this run's operating policy for package work - no network access, no browser use, no credentials, no global tools - not a harness-enforced sandbox. All verification used repository-declared Node-only commands on pinned Node 24.20.0 / npm 11.19.0 via a login shell.",
    "write_scope": "This run wrote only .agents/capability-profiles/cc-c0-contract-reviewer.json and evidence/WP-0A-A0-002/review-contract.md, both inside the WP-0A-A0-002 declared writable paths. It modified no other file, committed nothing, and pushed nothing.",
    "evidence": ["evidence/WP-0A-A0-002/review-contract.md"]
  },
  "accepted_work_package": "WP-0A-A0-002"
}
