{
  "schema_version": "1.0.0",
  "protocol_version": "1.0.0",
  "agent_run_id": "/claude/a5_loom",
  "vendor": "Anthropic",
  "model": "claude-opus-5-5",
  "capabilities": {
    "can_edit_files": true,
    "can_run_shell": true,
    "can_run_tests": true,
    "can_access_network": true,
    "can_use_browser": true,
    "can_access_external_secrets": false,
    "can_create_branch_or_worktree": true,
    "supported_languages": [
      "javascript",
      "json",
      "markdown",
      "thai"
    ]
  },
  "limitations": {
    "declaration_origin": "Declared on 2026-10-09 by A0 (/claude/a0_atlas) from the Product Owner disposition of that date, evidence/WP-0A-A0-001/product-owner-disposition-2026-10-09-ntf-a5.md (Q1, option (ข): add cc-a5-loom.json through WP-0A-A0-001). It is NOT a self-declaration: the values above were not supplied by /claude/a5_loom. They are the capabilities of the Claude Code harness A0 dispatches from, as cc-a6-relay.json was declared by A0 on 2026-09-02. The run must confirm or correct them in the §0 disclosure of its first A5 file, and a correction is made in this file before any signature of that run is cited. HISTORY: the id /claude/a5_loom was used before, undeclared, for a run that wrote WP-0A-DB-00 batch 090 as the Author's subagent, writing as /claude/a0_atlas (evidence/WP-0A-DB-00/a5-batch-090-probes-2026-09-13.md:3). That work carries no A5 signature and this declaration gives it none, retroactively or otherwise. This run is distinct from /root/a5_loom, the OpenAI Codex run declared separately in a5-loom.json in this directory, which keeps its own declaration and assignment unchanged.",
    "role_scope": "A5 (Loom) owner assessment and ratification of CTR-NTF-001 only; any other A5-owned contract, and any owed A5 review (e.g. batch 091 in WP-0A-DB-00), needs its own Owner disposition and an amendment of this profile before this run's signature on it counts (the disposition's Q1: A5 assesses WP-0A-CON-006 open_blockers [1], [2], [19] and [22]; the disposition's sequence item 2, under WP-0A-CON-006). SC-2's wording (WP-0A-CON-006 open_blockers[19]) must be in the CTR-NTF-001 manifest BEFORE this run ratifies, not only at the Candidate move; the Candidate move additionally needs A1's confirmation that SC-2 is met (disposition Q3). The Frozen-stage owner signature on CTR-NTF-001 (RFC-2026-031 §3.2 item 2) is out of scope of this profile until a new Product Owner disposition names this run for it. This run holds NO Author, Reviewer, Tester, Integration Owner, Product Owner, merge, or Gate G0 authority, and no Product/UX reviewer assignment on any package (role_assignments.product_reviewer_agent_run_id is unchanged wherever it is set). It must not author, review, test or integrate the work it assesses, and its assessment moves no contract's status by itself: the Draft -> Candidate move of CTR-NTF-001 is a separate PR, conditional on this run's signature on a manifest that already states SC-2 and on A1's confirmation that SC-2 is met (disposition Q3).",
    "benchmark_outcome": "None yet. No capability benchmark exists for this run. The Product Owner directed a short, conditioned, forward-scoped benchmark by Q0 (disposition Q2), as was done for /claude/a6_relay (evidence/capability-benchmarks/a6-relay-billing-cost-ops.md). That benchmark must exist on main, and recommend this run for the A5 assessment, before this run signs as A5. Until then this declaration is not, by itself, a benchmark or an external approval. The PR at sequence step 2 that updates .agents/capability-profiles/cc-a5-loom.json (benchmark_outcome, and any correction from the run's §0) must be either a WP-0A-A0-001 increment or a declared amendment on WP-0A-CON-006 (amends_without_owning, with its reason); otherwise verify-branch-scope fails it (R0-238-4).",
    "same_lineage_disclosure": "This run is spawned from the Author's run (/claude/a0_atlas), the same lineage as the author of the work it assesses. WP-0A-CON-006 open_blockers[1] records that A0 wrote the CTR-NTF-001 proposal A5 owns, and that ratification after the fact is a weaker and different control. The Product Owner accepted same-lineage ratification on condition that every A5 file carries a §0 disclosure of that lineage, and that A1, C0 and Q0 re-read the result (disposition Q4). A file of this run without that §0 disclosure is not an A5 signature.",
    "unavailable_tools": [
      "Product Owner authority",
      "merge authorization",
      "Gate G0 approval authority",
      "any production database or provider credential",
      "external notification provider accounts (LINE, email, SMS, push)",
      "GitHub branch-protection administration"
    ],
    "network_note": "Network and browser tools are present in the harness, so both booleans are declared true rather than understated. An A5 assessment reads the repository and runs repository-declared commands; it needs neither.",
    "verification_scope": "Repository-local reading and deterministic probes against the shipped contract, schemas and fixtures. Provider behaviour and any external system must be verified from their own authoritative systems; this run cannot verify them.",
    "evidence": "evidence/WP-0A-A0-001/product-owner-disposition-2026-10-09-ntf-a5.md"
  },
  "accepted_work_package": null
}
